<?xml version = "1.0" encoding = "UTF-8"?>

<jaxb-intros xmlns="http://www.jboss.org/xsd/jaxb/intros"
             xmlns:xsi="http://www.w3.org/2001/XMLSchema-instance"
             xsi:schemaLocation="http://www.jboss.org/xsd/jaxb/intros http://anonsvn.jboss.org/repos/jbossws/projects/jaxbintros/trunk/src/main/resources/jaxb-intros.xsd">


    <Class name="com.pouncilt.pricing.model.BasePricingLabelCount">
        <XmlAccessorType value="FIELD"/>
        <XmlTransient/>
        <Field name="locationNumber">
            <XmlElement name="locationNumber" required="true" namespace="http://www.pouncilt.com/pricing/pricinglabels/model"/>
        </Field>
    </Class>
    <Class name="com.pouncilt.pricing.model.CorporatePricingLabelCount">
        <XmlAccessorType value="FIELD"/>
        <XmlType propOrder="{'locationNumber', 'divisionPricingLabelCounts'}"/>
        <XmlRootElement name="corporatePricingLabelCount" namespace="http://www.pouncilt.com/pricing/pricinglabels/model"/>
        <Field name="divisionPricingLabelCounts">
            <XmlElement name="divisionPricingLabelCounts"  namespace="http://www.pouncilt.com/pricing/pricinglabels/model"/>
            <XmlJavaTypeAdapter value="com.pouncilt.pricing.model.jaxb.adapters.DivisionPricingLabelCountMapAdapter"/>
        </Field>
    </Class>
    <Class name="com.pouncilt.pricing.model.DivisionPricingLabelCount">
        <XmlAccessorType value="FIELD"/>
        <XmlType propOrder="{'locationNumber', 'regionPricingLabelCounts'}"/>
        <Field name="regionPricingLabelCounts">
            <XmlElement name="regionPricingLabelCounts" namespace="http://www.pouncilt.com/pricing/pricinglabels/model"/>
            <XmlJavaTypeAdapter value="com.pouncilt.pricing.model.jaxb.adapters.RegionPricingLabelCountMapAdapter"/>
        </Field>
    </Class>
    <Class name="com.pouncilt.pricing.model.RegionPricingLabelCount">
        <XmlAccessorType value="FIELD"/>
        <XmlType propOrder="{'locationNumber', 'districtPricingLabelCounts'}"/>
        <Field name="districtPricingLabelCounts">
            <XmlElement name="districtPricingLabelCounts" namespace="http://www.pouncilt.com/pricing/pricinglabels/model"/>
            <XmlJavaTypeAdapter value="com.pouncilt.pricing.model.jaxb.adapters.DistrictPricingLabelCountMapAdapter"/>
        </Field>
    </Class>
    <Class name="com.pouncilt.pricing.model.DistrictPricingLabelCount">
        <XmlAccessorType value="FIELD"/>
        <XmlType propOrder="{'locationNumber', 'storePricingLabelCounts'}"/>
        <Field name="storePricingLabelCounts">
            <XmlElement name="storePricingLabelCounts" namespace="http://www.pouncilt.com/pricing/pricinglabels/model"/>
            <XmlJavaTypeAdapter value="com.pouncilt.pricing.model.jaxb.adapters.StorePricingLabelCountMapAdapter"/>
        </Field>
    </Class>
    <Class name="com.pouncilt.pricing.model.StorePricingLabelCount">
        <XmlAccessorType value="FIELD"/>
        <XmlType propOrder="{'locationNumber', 'labelCount'}"/>
        <Field name="labelCount">
            <XmlElement name="labelCount" required="true" namespace="http://www.pouncilt.com/pricing/pricinglabels/model"/>
        </Field>
    </Class>
</jaxb-intros>